seed,suggestion,via
net worth calculator,what's my net worth calculator,question:what
net worth calculator,what is net worth calculator,question:what
net worth calculator,which net income calculator,question:what
net worth calculator,what's my net income calculator,question:what
net worth calculator,what is net price calculator,question:what
net worth calculator,what is net price calculator for college,question:what
net worth calculator,what is liquid net worth calculator,question:what
net worth calculator,how is net worth calculator,question:how
net worth calculator,how much net income calculator,question:how
net worth calculator,what is net income calculator,question:why
net worth calculator,what is my net worth calculator,question:why
net worth calculator,is net price calculator accurate,question:is
net worth calculator,net worth calculator app,alphabet:a
net worth calculator,net worth calculator australia,alphabet:a
net worth calculator,net worth calculator app india,alphabet:a
net worth calculator,net worth calculator age,alphabet:a
net worth calculator,net worth calculator at retirement,alphabet:a
net worth calculator,net income calculator australia,alphabet:a
net worth calculator,net income calculator alberta,alphabet:a
net worth calculator,net income calculator accounting,alphabet:a
net worth calculator,net income calculator arizona,alphabet:a
net worth calculator,net income calculator austria,alphabet:a
net worth calculator,net worth calculator business,alphabet:b
net worth calculator,net worth calculator by age canada,alphabet:b
net worth calculator,net worth calculator by age australia,alphabet:b
net worth calculator,net worth calculator by age 2025,alphabet:b
net worth calculator,net worth calculator by year,alphabet:b
net worth calculator,net worth calculator by age and gender,alphabet:b
net worth calculator,net worth calculator based on salary,alphabet:b
net worth calculator,net worth calculator by percentile,alphabet:b
net worth calculator,net worth calculator by age india,alphabet:b
net worth calculator,net worth calculator by state,alphabet:b
net worth calculator,net worth calculator comparison,alphabet:c
net worth calculator,net worth calculator compound interest,alphabet:c
net worth calculator,net worth calculator canada,alphabet:c
net worth calculator,net worth calculator canada percentile,alphabet:c
net worth calculator,net worth calculator canada by age,alphabet:c
net worth calculator,net worth calculator company,alphabet:c
net worth calculator,net worth calculator com,alphabet:c
net worth calculator,net price calculator college,alphabet:c
net worth calculator,net income calculator california,alphabet:c
net worth calculator,net income calculator canada,alphabet:c
net worth calculator,net worth calculator dave ramsey,alphabet:d
net worth calculator,net worth calculator dqydj,alphabet:d
net worth calculator,net worth calculator donegans,alphabet:d
net worth calculator,net worth calculator download,alphabet:d
net worth calculator,net worth calculation definition,alphabet:d
net worth calculator,net price calculator duke,alphabet:d
net worth calculator,net income calculator denmark,alphabet:d
net worth calculator,net price calculator dartmouth,alphabet:d
net worth calculator,net price calculator drexel,alphabet:d
net worth calculator,net income calculator dc,alphabet:d
net worth calculator,net worth calculator excel,alphabet:e
net worth calculator,net worth calculator excel free,alphabet:e
net worth calculator,net worth calculator excel template,alphabet:e
net worth calculator,net worth calculator excel sheet,alphabet:e
net worth calculator,net worth calculator euro,alphabet:e
net worth calculator,net worth calculator europe,alphabet:e
net worth calculator,net worth calculator excel india,alphabet:e
net worth calculator,net worth calculator easy,alphabet:e
net worth calculator,net worth calculation example,alphabet:e
net worth calculator,net price calculator emory,alphabet:e
net worth calculator,net worth calculator free,alphabet:f
net worth calculator,net worth calculator future,alphabet:f
net worth calculator,net worth calculator for retirement,alphabet:f
net worth calculator,net worth calculator formula,alphabet:f
net worth calculator,net worth calculator for company,alphabet:f
net worth calculator,net worth calculator fidelity,alphabet:f
net worth calculator,net worth calculator fire,alphabet:f
net worth calculator,net worth calculator for fafsa,alphabet:f
net worth calculator,net worth calculator for couples,alphabet:f
net worth calculator,net worth calculator for business,alphabet:f
net worth calculator,net worth calculator growth,alphabet:g
net worth calculator,net worth calculator google sheet,alphabet:g
net worth calculator,net worth calculator germany,alphabet:g
net worth calculator,net worth calculator global,alphabet:g
net worth calculator,net worth calculator groww,alphabet:g
net worth calculator,net worth calculator george kamel,alphabet:g
net worth calculator,net worth calculator google sheets template,alphabet:g
net worth calculator,net worth calculator gbp,alphabet:g
net worth calculator,net income calculator germany,alphabet:g
net worth calculator,net income calculator georgia,alphabet:g
net worth calculator,net worth calculator hypixel skyblock,alphabet:h
net worth calculator,net worth calculator hypixel,alphabet:h
net worth calculator,net worth calculator household,alphabet:h
net worth calculator,net worth calculator house,alphabet:h
net worth calculator,net price calculator harvard,alphabet:h
net worth calculator,net income calculator hawaii,alphabet:h
net worth calculator,net income calculator hourly,alphabet:h
net worth calculator,net price calculator high point university,alphabet:h
net worth calculator,net price calculator hofstra,alphabet:h
net worth calculator,net price calculator howard university,alphabet:h
net worth calculator,net worth calculator india,alphabet:i
net worth calculator,net worth calculator in future,alphabet:i
net worth calculator,net worth calculator including pension,alphabet:i
net worth calculator,net worth calculator india excel,alphabet:i
net worth calculator,net worth calculator ireland,alphabet:i
net worth calculator,net worth calculator individual,alphabet:i
net worth calculator,net worth calculator in excel,alphabet:i
net worth calculator,net worth calculator investment,alphabet:i
net worth calculator,net worth calculator in canada,alphabet:i
net worth calculator,net worth increase calculator,alphabet:i
net worth calculator,net price calculator johns hopkins,alphabet:j
net worth calculator,net income calculator japan,alphabet:j
net worth calculator,net price calculator jmu,alphabet:j
net worth calculator,net income calculator jamaica,alphabet:j
net worth calculator,net price calculator james madison university,alphabet:j
net worth calculator,net price calculator juilliard,alphabet:j
net worth calculator,net price calculator johnson and wales,alphabet:j
net worth calculator,net income calculator new jersey,alphabet:j
net worth calculator,net price calculator st john's university,alphabet:j
net worth calculator,net price calculator st joseph's university,alphabet:j
net worth calculator,net worth calculator kenya,alphabet:k
net worth calculator,net income calculator kenya,alphabet:k
net worth calculator,net income calculator kansas,alphabet:k
net worth calculator,net income calculator kentucky,alphabet:k
net worth calculator,net price calculator ku,alphabet:k
net worth calculator,net price calculator kent state,alphabet:k
net worth calculator,net price calculator kutztown university,alphabet:k
net worth calculator,net price calculator kentucky,alphabet:k
net worth calculator,net price calculator kennesaw state,alphabet:k
net worth calculator,net price calculator kenyon,alphabet:k
net worth calculator,net income calculator london,alphabet:l
net worth calculator,net income calculator luxembourg,alphabet:l
net worth calculator,net price calculator liberty university,alphabet:l
net worth calculator,net price calculator lehigh,alphabet:l
net worth calculator,net price calculator loyola chicago,alphabet:l
net worth calculator,net price calculator lsu,alphabet:l
net worth calculator,net income calculator los angeles,alphabet:l
net worth calculator,net price calculator lmu,alphabet:l
net worth calculator,net price calculator lehigh university,alphabet:l
net worth calculator,net price calculator lafayette college,alphabet:l
net worth calculator,net worth calculator money guy,alphabet:m
net worth calculator,net worth calculator malaysia,alphabet:m
net worth calculator,net worth calculator millionaire next door,alphabet:m
net worth calculator,net worth calculator mortgage,alphabet:m
net worth calculator,net worth calculator married,alphabet:m
net worth calculator,net worth calculator money guy show,alphabet:m
net worth calculator,net worth calculator married couple,alphabet:m
net worth calculator,net worth calculator meaning,alphabet:m
net worth calculator,net worth calculation method,alphabet:m
net worth calculator,net income calculator malaysia,alphabet:m
net worth calculator,net worth calculator nerdwallet,alphabet:n
net worth calculator,net worth calculator nz,alphabet:n
net worth calculator,net income calculator netherlands,alphabet:n
net worth calculator,net income calculator nz,alphabet:n
net worth calculator,net price calculator nyu,alphabet:n
net worth calculator,net income calculator nyc,alphabet:n
net worth calculator,net income calculator new york,alphabet:n
net worth calculator,net income calculator nova scotia,alphabet:n
net worth calculator,net price calculator northwestern,alphabet:n
net worth calculator,net income calculator nj,alphabet:n
net worth calculator,net worth calculator over time,alphabet:o
net worth calculator,net worth calculator online,alphabet:o
net worth calculator,net worth calculator of company,alphabet:o
net worth calculator,net worth calculator ontario,alphabet:o
net worth calculator,net worth calculator online free,alphabet:o
net worth calculator,net worth calculator of an individual,alphabet:o
net worth calculator,net worth calculation of partnership firm,alphabet:o
net worth calculator,net worth calculation of a private limited company,alphabet:o
net worth calculator,net worth calculation of a company in india,alphabet:o
net worth calculator,net worth calculation on balance sheet,alphabet:o
net worth calculator,net worth calculator percentile,alphabet:p
net worth calculator,net worth calculator projection,alphabet:p
net worth calculator,net worth calculator percentile 2025,alphabet:p
net worth calculator,net worth calculator percentage,alphabet:p
net worth calculator,net worth calculator predictor,alphabet:p
net worth calculator,net worth calculator philippines,alphabet:p
net worth calculator,net worth calculator pension,alphabet:p
net worth calculator,net worth calculator percentile canada,alphabet:p
net worth calculator,net worth percentile calculator us,alphabet:p
net worth calculator,net income calculator philippines,alphabet:p
net worth calculator,net income calculator quebec,alphabet:q
net worth calculator,net price calculator quinnipiac,alphabet:q
net worth calculator,net price calculator quick start guide,alphabet:q
net worth calculator,net income calculator quebec 2025,alphabet:q
net worth calculator,net income calculator qc,alphabet:q
net worth calculator,net income calculator qld,alphabet:q
net worth calculator,net present value calculator quarterly payments,alphabet:q
net worth calculator,net income tax calculator quebec,alphabet:q
net worth calculator,net present value calculation questions and answers pdf,alphabet:q
net worth calculator,net present value calculation questions,alphabet:q
net worth calculator,net worth calculator ramsey,alphabet:r
net worth calculator,net worth calculator retirement,alphabet:r
net worth calculator,net worth calculator reddit,alphabet:r
net worth calculator,net worth calculator rbc,alphabet:r
net worth calculator,net worth calculator rebel finance,alphabet:r
net worth calculator,net worth calculator ranking,alphabet:r
net worth calculator,net worth calculator ramit,alphabet:r
net worth calculator,net worth calculator real estate,alphabet:r
net worth calculator,net worth calculator ramsey solutions,alphabet:r
net worth calculator,net worth calculation rbi,alphabet:r
net worth calculator,net worth calculator spreadsheet,alphabet:s
net worth calculator,net worth calculator skyblock,alphabet:s
net worth calculator,net worth calculator spreadsheet download,alphabet:s
net worth calculator,net worth calculator singapore,alphabet:s
net worth calculator,net worth calculator south africa,alphabet:s
net worth calculator,net worth calculator sunlife,alphabet:s
net worth calculator,net worth calculator sheet,alphabet:s
net worth calculator,net worth calculator simple,alphabet:s
net worth calculator,net worth calculator salary,alphabet:s
net worth calculator,net worth calculator schwab,alphabet:s
net worth calculator,net worth calculator template,alphabet:t
net worth calculator,net worth calculator td,alphabet:t
net worth calculator,net income calculator texas,alphabet:t
net worth calculator,net price calculator template,alphabet:t
net worth calculator,net income calculator toronto,alphabet:t
net worth calculator,net income calculator tennessee,alphabet:t
net worth calculator,net price calculator tufts,alphabet:t
net worth calculator,net price calculator tulane,alphabet:t
net worth calculator,net price calculator texas a&m,alphabet:t
net worth calculator,net worth trajectory calculator,alphabet:t
net worth calculator,net worth calculator usa,alphabet:u
net worth calculator,net worth calculator uk,alphabet:u
net worth calculator,net worth calculator uk free,alphabet:u
net worth calculator,net worth calculator usaa,alphabet:u
net worth calculator,net worth calculation under companies act 2013,alphabet:u
net worth calculator,net income calculator uk,alphabet:u
net worth calculator,net price calculator usc,alphabet:u
net worth calculator,net price calculator upenn,alphabet:u
net worth calculator,us net income calculator,alphabet:u
net worth calculator,net income calculator utah,alphabet:u
net worth calculator,net income calculator virginia,alphabet:v
net worth calculator,net price calculator vanderbilt,alphabet:v
net worth calculator,net price calculator virginia tech,alphabet:v
net worth calculator,net price calculator villanova,alphabet:v
net worth calculator,net price calculator vassar,alphabet:v
net worth calculator,net price calculator vcu,alphabet:v
net worth calculator,net income calculator vancouver,alphabet:v
net worth calculator,net price calculator vt,alphabet:v
net worth calculator,net price calculator villanova university,alphabet:v
net worth calculator,net income calculator vermont,alphabet:v
net worth calculator,net worth calculator with pension,alphabet:w
net worth calculator,net worth calculator with salary,alphabet:w
net worth calculator,net worth calculator world,alphabet:w
net worth calculator,net worth calculator website,alphabet:w
net worth calculator,net worth calculation worksheet,alphabet:w
net worth calculator,net worth calculation with example,alphabet:w
net worth calculator,net worth calculation with mortgage,alphabet:w
net worth calculator,net income calculator washington,alphabet:w
net worth calculator,net income calculator wisconsin,alphabet:w
net worth calculator,net price calculator washu,alphabet:w
net worth calculator,net price calculator xavier university,alphabet:x
net worth calculator,net worth calculator youtube,alphabet:y
net worth calculator,net price calculator yale,alphabet:y
net worth calculator,net income calculator yearly,alphabet:y
net worth calculator,net income calculator new york city,alphabet:y
net worth calculator,net price calculator new york university,alphabet:y
net worth calculator,quick net price calculator yale,alphabet:y
net worth calculator,net worth calculator in 10 years,alphabet:y
net worth calculator,net income calculator new york state,alphabet:y
net worth calculator,net income calculator zurich,alphabet:z
net worth calculator,net income calculator zug,alphabet:z
net worth calculator,net income calculator new zealand,alphabet:z
